&quot;Dramatic Prairie Dog - Where Have I Been?&quot;;&quot;personal/blog/animals/dramatic-prairie-dog-where-have-i-been&quot;;&quot;I happened to be served up the following video, which is by definition "cute", and I highly recommend it. However, what it led me to was the Dramatic Prairie Dog phenomenon. It's a simple shot of a prairie dog from a Japanese kid's show, but someone added a dramatic flourish of music. Here's the original video:
<!--break-->
[video:http://www.youtube.com/watch?v=jHjFxJVeCQs]

And here are some of my favorite remixes:

[video:http://www.youtube.com/watch?v=2lXL7HflU1Q]

[video:http://www.youtube.com/watch?v=2Uaw2CdjU3c]

[video:http://www.youtube.com/watch?v=WiloZd1H4ow]

[video:http://www.youtube.com/watch?v=ZBRI3iHmLys]

The original video:

[video:http://www.youtube.com/watch?v=qUJzcU6vbPE]&quot;;&quot;1199622879&quot;;&quot;textile&quot;
&quot;Crash Diet Weekends - pt. 1: Dairy Free&quot;;&quot;personal/blog/diet/crash-diet-weekends-pt-1-dairy-free&quot;;&quot;David is now traveling every weekend until February. Since I've been on a weight-loss kick, I've decided to take his absence to try a month of weekend crash diets. Every weekend, I'll pick a new theme. I should say that some of these are not crash diets but legitimate lifestyle choices. However, they are choices that I never thought I'd make, so I'm trying them out for a weekend since you can stick just about any diet for a weekend.

This is the first weekend and I've chosen to give up dairy. If I had a normally bad diet, I don't think giving up dairy would make a bit of difference, but I'm already on a pretty healthy and restrictive diet, so this is just the icing on the cake. It's a chance for my system to clean itself out. I tend to think that dairy slows down our digestive system and I think a good part of healthy eating is getting your body to be able to process food faster and more completely. I have also heard that people with dark circles under their eyes have a low-level dairy allergy, so I'm hoping to see a difference in my complexion.

I don't have a lot of dairy normally, but the dairy that I have is heavily ingrained in my routine, so I had to be able to substitute. For instance, I have milk in my morning protein shake and then my coffee. I'd have to change both of those things. I had tried soy milk several months ago and while I liked the taste, it was definitely not making my digestive system happy. So this time around I'm trying almond milk. I had some last night and was surprised how good the unsweetened kind is. At first it seems pretty watery, but the aftertaste has a delicious, nutty tang to it. So that's my substitute for milk.

I have recently gotten into a daily dose of yogurt. That's going to have to be replaced as well. I may try soy yogurt in the hopes that the enzymes in yogurt will balance out the issue of the digestive problems of soy. I've also stocked the refrigerator with watermelon, which is another healthy snack that I'll have in place of my usual yogurt snack.

I think the hard part will be salad dressing. I've been getting into salads a lot lately. Even a non-creamy cobb salad has blue cheese in it. I suppose that my salads will have to have oil vinegar dressing for the time being. Anyway, it's just for a weekend.

I'll be sure to do another entry next week to discuss any changes with a dairy free diet.&quot;;&quot;1200071518&quot;;&quot;textile&quot;
&quot;I’m Not as Much Into You As You Are To Me&quot;;&quot;personal/blog/politics/i-m-not-much-you-you-are-me&quot;;&quot;I wish I had started keeping track of all the calls I've been getting from political candidates lately. It was at least five calls yesterday. They've all been democratic candidates. It makes me wish I had signed up as a republican, so I could have compared the average republican call to the average democratic call. Although, now that I think of it, why bother. They're all going to be the same.
<!--break-->

The Clinton calls go like this:
<blockquote>This is Hillary Clinton. In my XX years of EXPERIENCE bringing about CHANGE blah-blah-blah CHANGE blah-blah EXPERIENCE.</blockquote>
The Obama calls go like this:
<blockquote>This is Barak Obama. On February 4th, vote for HOPE and CHANGE blah-blah-blah HOPE blah-blah CHANGE</blockquote>
It really seems aggressively anti-substantive. I guess it's foolish to expect that they could say something of value in a 1 minute recorded voice message. But if they aren't going to say anything actually relevant or important, why bother me?

The whole thing is making me feel very...used. And creeped out.

I got an email from Obama yesterday that was titled: "One Last Thing..." Did he not get his message in the previous 2 emails he sent me that day? He starting to sound like someone that can't end a telephone conversation for fear I'll never call back.

I wish political candidates realized that they should be following dating rules. When you're in that initial dating phase and you aren't sure if you're going to go all the way, you would NEVER call someone that twice in one day! That would sound way too desperate and needy. I would have been happy to have a call on Friday from the candidates that went something like: "Hey. It's been great getting to know you. I hope we can continue our relationship. Have a great weekend. Call me if your bored." And then nothing until primary day.

They should let me have some time to sit and think about it, chat with friends at Sunday brunch, etc. The soonest they should call would be the eve of the primaries with a "Happy Primary Day. I've been thinking about you a lot lately. I hope you had a good weekend. Think of me at the polls."

The candidates have crossed over from courting me into stalking me. At this point, I'm looking for anyone that knows how to not sound desperate.&quot;;&quot;1202225195&quot;;&quot;textile&quot;
&quot;Am I the Lisa Simpson of Gay Men?&quot;;&quot;personal/blog/television/am-i-lisa-simpson-gay-men&quot;;&quot;One of the hardest things about getting older is that you can't tell if you're turning into a grumpy old crank or if you're just starting to notice how irritating the world actually is.

I just saw this commercial on Comedy Central. I found it offensive on so many levels. The most obvious and irritating thing about the commercial is that they equate meeting people with picking out clothes. They might as well be advertising crystal meth.

And I love the guy that they picked for "smart". I think I must have very different standards for what constitutes "smart".
<!--break-->

[video:http://www.youtube.com/watch?v=BbvPzdX-UwI]&quot;;&quot;1202236048&quot;;&quot;textile&quot;
&quot;Astrophysicist&quot;;&quot;personal/blog/comedy/astrophysicist&quot;;&quot;Okay...just to even out my feelings about gay culture from my last post: here are some clips from a very funny drag queen movie: Girls Will Be Girls.
<!--break-->

[video:http://www.youtube.com/watch?v=TVI0u12m-Ng]

[video:http://www.youtube.com/watch?v=XpGIVzDlI-s]&quot;;&quot;1202236447&quot;;&quot;textile&quot;
&quot;My Tired Feet&quot;;&quot;personal/blog/dancing/my-tired-feet&quot;;&quot;I guess I have to face the fact that I'm not going to have my new site up any time soon. At this point, I think hitting January 15th would be a tough deadline.
<!--break-->

So in the meantime, here's a video of our latest dance performance. Yours truly is the one shaking the finger at the dancer playing the little girl in the beginning. Then I re-emerge later.

This was a great performance. I had a lot of fun because there's a bit more acting, the choreography was not quite as demanding, and it had a creepy Halloween theme to it.

[video:http://www.youtube.com/watch?v=oFqsz6lms1g]&quot;;&quot;1193011506&quot;;&quot;textile&quot;
&quot;Raw Food&quot;;&quot;personal/blog/diet/raw-food&quot;;&quot;My friend, Renee, has been talking about raw food restaurants here in New York. She turned me on to one in particular, <a target="_blank" href="http://www.purefoodandwine.com/">Pure Food and Wine</a>. There's a little blurb on their website describing raw food.

Last night, we were looking for a restaurant to take a kosher friend to and I suggested that we try this place out. They had a sample menu online and everything sounded delicious by the description of things.

Our kosher friend, Sarah, upon hearing that we were going to a raw food restaurant said "Aren't there a lot of articles about raw food restaurants making people sick?" When we pressed her for more information, it turns out she was talking about a Sex and the City episode.

So we got there and I ordered a cocktail. It was good, but definitely felt light on the alcohol part. They use sake and prosecco for their main alcohol. I don't know what it is about sake that makes it more organic/raw than other alcohol.

The menu was different than what was on the web, but still as tasty-sounding.

When the food arrived, I was blown away. You would never be able to tell in a million years that there was no dairy - the food was so rich and creamy. I really don't know how they did the things they did.

Both the appetizer and the entree were extremely good. I was thinking that I might not fill up from eating there and was fully prepared to get dessert on the way home. But halfway through my entree, my stomach said "I'm filling up! Slow down!"

David and I decided to split a sundae for dessert. It was amazing. I never never never would have known that it was vegan. In fact, I preferred it to a regular dairy sundae because I didn't feel weighed down and bloated from eating it.

Even the kosher doubter had a great meal. She confessed that she was ready to harass me about the meal. But she left with a changed attitude and a happy palate.&quot;;&quot;1199017646&quot;;&quot;textile&quot;
&quot;Saw, the Musical&quot;;&quot;personal/blog/movies/saw-musical&quot;;&quot;I just saw <a target="_blank" href="http://www.sweeneytoddmovie.com/">Sweeney Todd</a>. I loved it. The filming is impeccable. The scenes of 19th century London are stunning. The story is captivating (they made some changes from the stage version that tightened it up).

I had read a review in The New York Times that said that it is as gory as Saw. I haven't actually seen Saw all the way through, though I think I can safely saw that it is not nearly as gory as Saw. In fact, the blood is too bright red to be realistic. It's meant to be over-the-top Grand Guignol. There are some big gross-out moments, of course, but it's always in Tim Burton style - meaning that it's effective, but cartoonish.

The acting is great. The singing is not as good as you'd like, but it's no surprise. Johnny Depp had a bit of a rock-and-roll flair to his singing, which I expected. He hit the notes better than I was expecting. But his acting is just so good, you have to forgive him.

I had seen a revival of Sweeney Todd last year on Broadway that was excellent. I really shouldn't compare the two, because there's no coming close to how talented the cast was in the stage version; however, the movie has one thing that I've never seen in a stage version of Sweeney Todd - it's creepy fun.

I really can't think of anyone that I wouldn't send to go see it.&quot;;&quot;1199060394&quot;;&quot;textile&quot;
&quot;Mac Attack&quot;;&quot;personal/blog/mac-os/mac-attack&quot;;&quot;I wish I were a stronger man. I wish I had more resolve. I wish I didn't get obsessed with buying the latest <em>something</em> and then spend my time pining away for it.

Somehow, a few weeks ago, I got obsessed with getting a Macintosh. I think it started with my interest in going open source. As I read programming manuals, I began to notice that the installation instructions for Mac were very brief. Many of them said - "If you have Mac OS X, this software is already on your machine". I had experimented with putting Linux on my machine, but when I saw how limited the software options were, I ran screaming. No Photoshop? No Illustrator? No iTunes?

Then it dawned on me...now that Mac OS X is built on top of Unix, you get all the benefits of open source development, with commercial software options and a really cool OS.

This started a period where I noticed everything that bugged me about my PC. I started to notice how poor my video and audio playback was on my PC. I would wait forever for the hard drive to finish spinning before the computer would come to life. A couple of weekends ago I tried to set up Drupal (open source content management system) on my home machine. I spent a better part of the weekend and couldn't make it work. It drove me crazy.

At that point, I was completely decided to get a Mac. It was just a matter of time. I felt like a consumate addict - every morning I told myself that today was really not the best day to get a Mac. Just be patient. Rise above your desires. You still can get everything done that you need to get done. None of it was working.

Eventually I got the call from my pseudo-employer that they would reimburse me for a Mac and the associated software I would need to get. Needless to say, I was off to the store to get my new Mac.

I got a 15", MacBook Pro. I spent extra for the faster processor, more memory, and bigger hard drive. I spent almost as much money on the software as I did on the hardware. By the time I got home, I was giddy with anticipation. I hate to admit it, but the Mac exceeded my expectations. I must have said "that is soooo cool" to myself three times in the first 15 minutes. Some of the cool factors are:
<ul>
	<li>I was trying to figure out where to plug the power cord in, when it leapt out of my hand and into its socket. Why? It's magnetic! All you have to do is get close to the slot! That way if someone trips over the power cord, the cord slips out of its slot without bringing the laptop crashing down.</li>
	<li>As part of the setup, it takes a picture of you to use with your profile.</li>
	<li>It automatically finds a nearby wireless connection during startup. It was downloading software updates in no time.</li>
</ul>
Within 30 minutes, I started to get feel like that Mac snobbery descend upon me. I had become part of the computer elite. I envisioned that all Mac users would someday settle our own planet like a Star Trek colony of peace-loving, creative, intellectuals.

It's sad that Macs will probably never break the barrier of market share. I think it will always remain a niche product. Maybe that's not so bad. But I feel bad for all those people out there that are missing out on a super cool computing experience.

And by the way, remember how I spent a weekend trying to get Drupal up and running on my Windows machine and gave up? I had it up and running within an hour on my new Mac.

Aaahhhhh....&quot;;&quot;1178068788&quot;;&quot;textile&quot;
&quot;May I Have Some Privacy, Please&quot;;&quot;personal/blog/dancing/may-i-have-some-privacy-please&quot;;&quot;As it turns out, there were two people making videos of our Charleston performance at Frim Fram. No one in our troupe knows who took these or how they got posted on YouTube. It's kinda creepy. Am I being filmed right now without my permission? Probably.
<!--break-->
Anyway, this one has a slightly better angle to see the whole dance routine.

[video:http://www.youtube.com/watch?v=cMZ_LpI0-xY]&quot;;&quot;1178109334&quot;;&quot;textile&quot;
&quot;A Furrier Keith&quot;;&quot;personal/blog/oz/furrier-keith&quot;;&quot;David was taking a nap this weekend. He looked over at my side of the bed and Oz was in my exact position - head on the pillow, stretched out on the bed. He was being David's "Keith Substitute". So he took a picture with his cell phone.
<!--break-->
[flickr-photo:id=2203123084]&quot;;&quot;1179148637&quot;;&quot;textile&quot;
&quot;A Summer Breeze…Came Blowin’ In…&quot;;&quot;personal/blog/beauty/summer-breeze-came-blowin&quot;;&quot;It appears that summer has hit here in NYC. It was in the 80's today.

I had to get my hair cut, and I was in one of those crazy moods. I decided to get it totally buzzed. I had been thinking about doing this for a while. I have a lot of friends that have their head shaved or closely buzzed, and I often think that they look best on the first day of the haircut. So I went to a barber and asked for a buzzcut - not completely shaved, but short. And I didn't look at it until he was done.

And a good thing, too. I had those five minutes to prepare a look of stony optimism to not to reveal to the barter that my world had crumbled on the inside.

I took a glance in the mirror at the end. It looked FAR WORSE than I would have imagined. Somewhere after paying and stepping out of the barber shop, I felt better. I caught a look of myself in the window, and it didn't look chemo-inspired, it looked military. I looked like a bad-ass.

I went to Whole Foods and no one pointed and laughed. No one came up to ask me what type of cancer I had. The breeze felt fantastic on my head. Why - I may just keep this haircut for a while!

I got home and wondered if the pups were going to sniff my head, wondering what happened. Oz was fine. Gogo took a look at me and went nuts. She got all excited and even gave me TWO KISSES! Maybe girls dig military haircuts.

I was feeling pretty gosh-darn great about the haircut when I took a serious look in the mirror. It's not good. It's somewhere in between escaped mental patient and just-got-home-from-the-hospital. I'm hoping in a couple of days it will have grown out enough to be passable. For the time being, I'm going to have to wear a hat - at least when I'm with David.

I was planning on taking a picture for this entry, then chickened out when I tried to take a decent shot. I finally decided to be brave, but so as not to horrify people when this page loads, I've hidden the picture.

NOTE: After some consideration, I've decided I'm not brave. I took down the photo.&quot;;&quot;1180128537&quot;;&quot;textile&quot;
&quot;Only for the Prurient at Heart&quot;;&quot;personal/blog/comic-books/only-prurient-heart&quot;;&quot;A friend sent me this link the other day. WARNING: you really have to have your mind in the gutter to find this funny.

Luckily, that's where my head is 80% of the time and I laughed quite hardily at almost all of these. I read it a second time after working until midnight. Working late definitely helps put you in the right mood to find this funny.

<a target="_blank" href="http://www.yesbutnobutyes.com/archives/2007/03/top_15_unintent.html">Top 15 Unintentionally Funny Comic Book Panels</a>&quot;;&quot;1181617870&quot;;&quot;textile&quot;
&quot;Why There Are No Updates&quot;;&quot;personal/blog/hosting/why-there-are-no-updates&quot;;&quot;Normally, you can chalk up my lack of recent blog entries to laziness. Well...maybe that's too harsh. Distractions is perhaps a better word. Anyway, I have a reason this time.

I had written a nice long blog entry about a movie that I had been hunting down on DVD for a long time. It took me about a half hour to write. I click "post" and the browser-busy icon kept spinning. After several minutes, the server timed out and I lost all my work.

Unfortunately, this is not the first time this has happened. My blog software is Wordpress, which is pretty good, but it's PHP running on Windows. My hosting company hasn't quite worked out the kinks and unfortunately the server hangs from time to time. You would think I would finally get in the habit of writing posts in a separate application so as not to lose any work. Alas, no.

So when I lost that entry, I vowed to re-do my site and put it on a Linux server. The new site is going to be pretty great. It will be divided into three separate sections: Business, Personal, and Creative. The content of the current site will be moved into the "Personal" section.

To make sure that I don't take forever, I'm telling everyone that <strong>the new site will be live by August 15th</strong>! Be sure to come back on the 15th for the new site. There will still be a lot under construction, I'm sure, but at least the current site will be completely migrated.

See you back here soon!&quot;;&quot;1184160584&quot;;&quot;textile&quot;
&quot;Barney’s: The Haul&quot;;&quot;personal/blog/barneys/barney-s-haul&quot;;&quot;The Barney's Warehouse Sale ends in a couple of days. I decided this year to go at the end to make use of any last minute markdowns. In addition to the typically low prices of the warehouse sale, everything was marked down an additional 40%.
<!--break-->

<dl class="side-by-side">
  <dd>[flickr-photo:id=2297298998,size=m]</dd>
  <dd>I got two pants. One is a charcoal denim. The other is a distressed khaki. The khakis were only $23. How could I not get them? I'll turn them into shorts if I don't like them.</dd>
</dl>

<dl class="side-by-side">
  <dd>[flickr-photo:id=2297299176,size=m]</dd>
  <dd>This is a basic Barney's work shirt. It's blue and gray striped. Good for David or myself.</dd>
</dl>

<dl class="side-by-side">
  <dd>[flickr-photo:id=2297299284,size=m]</dd>
  <dd>This is a dark charcoal shirt with a hint of red and blue in thin stripes. Very good for a casual night on the town.</dd>
</dl>

<dl class="side-by-side">
  <dd>[flickr-photo:id=2297299370,size=m]</dd>
  <dd>This is a loud, Zegna sport shirt. The fabric is a very wrinkly cotton.</dd>
</dl>

<dl class="side-by-side">
  <dd>[flickr-photo:id=2296504391,size=m]</dd>
  <dd>This is a Michael Kors shirt that normally retails at $275! I got it for a hell of a lot less. The fabric is very sturdy. The craftsmanship is excellent.</dd>
</dl>

<dl class="side-by-side">
  <dd>[flickr-photo:id=2297299538,size=m]</dd>
  <dd>While I was inline, someone had set aside this Canali linen shirt. I grabbed it. The person behind me in line had his eye on it, so I had to get it before he did.</dd>
</dl>

<dl class="side-by-side">
  <dd>[flickr-photo:id=2296504585,size=m]</dd>
  <dd>When picking ties for David, I aim for one very safe choice, one choice that is a bit out of his comfort zone, and one tie that I will have a hard time talking him into wearing (but will get a ton of compliments). This is the safe choice.</dd>
</dl>

<dl class="side-by-side">
  <dd>[flickr-photo:id=2297299746,size=m]</dd>
  <dd>This is the choice just outside of the comfort zone.</dd>
</dl>

<dl class="side-by-side">
  <dd>[flickr-photo:id=2296504809,size=m]</dd>
  <dd>And this is the tie that will get a ton of compliments when I finally convince David to wear it.</dd>
</dl>

<dl class="side-by-side">
  <dd>[flickr-photo:id=2297299902,size=m]</dd>
  <dd>This was the most expensive item I bought. A gorgeous Paul Smith shirt. You have to zoom in to appreciate it.</dd>
</dl>

<dl class="side-by-side">
  <dd>[flickr-photo:id=2297299990,size=m]</dd>
  <dd>And to go with the shirt, I got this unbelievable tie.</dd>
</dl>

<dl class="side-by-side">
  <dd>[flickr-photo:id=2297300048,size=m]</dd>
  <dd>When I was first looking for ties, I was getting very discouraged. Then I found this tie buried on a rack. It has little blue Krishna's sewn in! I've told David that he can't wear this tie. It's MINE MINE MINE!</dd>
</dl>&quot;;&quot;1172796262&quot;;&quot;textile&quot;
&quot;Dream Donuts&quot;;&quot;personal/blog/food/dream-donuts&quot;;&quot;I'm always looking for an excuse to make donuts. I love donuts and I think they're highly underrated. I want to really experiment with donuts and make some fun ones.

So I'm planning a donut tasting party. I want to come up with several different recipes to try out on people. So here's what I'm thinking of:
<!--break-->
<ul>
	<li><strong>Vanilla Donuts</strong> - I'm going to use the family recipe from Grandma Fern</li>
	<li><strong>Raspberry Donuts</strong> - Same recipe as above, but using raspberry glaze</li>
	<li><strong>Pistachio Spice</strong> - One of my favorite aspects of donuts is that bread-y, cinnamon, goodness. This recipe will combine middle-eastern spices with pistachios in a cake donut.</li>
	<li><strong>Chocolate Banana Cream</strong> - I love chocolate and banana together. For this, I'll make a banana cream to inject in the center of the donut and put chocolate glaze on the outside.</li>
	<li><strong>Tangerine Filled</strong> - I wanted to do one curd-filled recipe. I keep waffling between tangerine and grapefruit. For this, I was going to use a brioche dough for the donut.</li>
	<li><strong>Strawberry Filled</strong> - Same recipe as above, but using a jam. Strawberry is the classic filling. Maybe I'll use blackberry instead since I think it's an under-rated flavor.</li>
	<li><strong>Chocolate Cake</strong> - I think I need another cake donut, and I'm missing some chocolate. Maybe I'll make it Mexican chocolate for fun.</li>
</ul>
If you have any ideas for flavors, please let me know. I'd love some ideas or feedback on the flavors.&quot;;&quot;1173103156&quot;;&quot;textile&quot;
&quot;Your Flight Has Been Re-routed Through Hell&quot;;&quot;personal/travel/your-flight-has-been-re-routed-through-hell&quot;;&quot;We've all heard the horror stories of people being stuck in airports for days because their flights were delayed. Somehow, it never really sunk in how bad that would be. I guess it was too far removed from my own experience.

